{
  "schema_version": "1.0",
  "photo": {
    "id": "微信图片_20261011184028_809_540.jpg",
    "subject": "portrait",
    "purpose": "social"
  },
  "weights": {
    "composition": 30,
    "exposure": 25,
    "focus": 20,
    "color": 15,
    "subject": 10
  },
  "total": {
    "score": 9.5,
    "max": 10,
    "level": "优秀",
    "summary": "整体 优秀（9.5/10）。最该先改：EXP-011——黄昏逆光氛围下，人物暗部（外套/面部阴影侧）偏暗、明暗对比偏大，可用反光板补光或在后期提亮阴影，避免主体发黑"
  },
  "dimensions": [
    {
      "id": "COMP",
      "name": "构图",
      "score": 9.5,
      "max": 10,
      "highlights": [],
      "issues": [
        "COMP-006"
      ]
    },
    {
      "id": "EXP",
      "name": "曝光",
      "score": 8.5,
      "max": 10,
      "highlights": [],
      "issues": [
        "EXP-011"
      ]
    },
    {
      "id": "FOC",
      "name": "对焦与清晰度",
      "score": 10.0,
      "max": 10,
      "highlights": [],
      "issues": []
    },
    {
      "id": "COL",
      "name": "色彩与白平衡",
      "score": 10.0,
      "max": 10,
      "highlights": [
        "黄昏暖黄氛围保留，未被 AWB 抹平成中性白，色温处理正确"
      ],
      "issues": []
    },
    {
      "id": "SUB",
      "name": "内容与主体",
      "score": 10.0,
      "max": 10,
      "highlights": [
        "主题鲜明——黄昏山野氛围人像，一眼可辨",
        "主体从山野背景中分离，画面干净，做了减法"
      ],
      "issues": []
    },
    {
      "id": "PPC",
      "name": "后期建议",
      "score": 10.0,
      "max": 10,
      "highlights": [],
      "issues": []
    }
  ],
  "issues": [
    {
      "rule_id": "EXP-011",
      "dimension": "EXP",
      "impact": "medium",
      "reason": "黄昏逆光氛围下，人物暗部（外套/面部阴影侧）偏暗、明暗对比偏大，可用反光板补光或在后期提亮阴影，避免主体发黑",
      "action": "逆光脸黑成剪影时要求反光板斜上方补；脸比背景还亮是补过了，板退远；没有反光板可用白墙、白色 T 恤代替。",
      "conflicts": null
    },
    {
      "rule_id": "COMP-006",
      "dimension": "COMP",
      "impact": "low",
      "reason": "侧身人像需确认视线前方留白充足，避免视线被画面边缘堵住",
      "action": "人物贴视线方向边缘时，反向裁切或重拍，给视线方向留 1/3 以上空间。",
      "conflicts": null
    }
  ],
  "edits": [],
  "annotations": {
    "rule_of_thirds": true,
    "subject_point": [
      0.42,
      0.45
    ],
    "horizon": {
      "angle": 1,
      "rotated": false
    }
  },
  "sources": {
    "rules_referenced": [
      "COMP-006",
      "EXP-011"
    ],
    "conflicts_referenced": [],
    "note": "规则来自 rules/，原始来源见各条目 source 字段"
  }
}